{
  "$schema": "https://json-schema.org/draft/2020-12/schema",
  "title": "SessionSummary",
  "description": "one row of GET /sessions and the header of GET /sessions/{id}.",
  "type": "object",
  "properties": {
    "session_id": {
      "$ref": "#/$defs/session_id"
    },
    "started_at": {
      "$ref": "#/$defs/timestamp"
    },
    "ended_at": {
      "type": [
        "string",
        "null"
      ],
      "pattern": "^\\d{4}-\\d{2}-\\d{2}T\\d{2}:\\d{2}:\\d{2}(\\.\\d{1,6})?Z$",
      "description": "utc, iso 8601, ends in Z, e.g. 2026-10-24T18:03:11.250Z"
    },
    "source": {
      "$ref": "#/$defs/source"
    },
    "geo": {
      "$ref": "#/$defs/Geo"
    },
    "attacker": {
      "$ref": "#/$defs/Attacker"
    },
    "status": {
      "type": "string",
      "enum": [
        "approaching",
        "at_gate",
        "inside",
        "ended"
      ]
    },
    "login_fails": {
      "type": "integer",
      "minimum": 0
    },
    "command_count": {
      "type": "integer",
      "minimum": 0
    },
    "story": {
      "type": [
        "string",
        "null"
      ]
    }
  },
  "required": [
    "session_id",
    "started_at",
    "ended_at",
    "source",
    "geo",
    "attacker",
    "status",
    "login_fails",
    "command_count",
    "story"
  ],
  "additionalProperties": false,
  "$defs": {
    "session_id": {
      "type": "string",
      "minLength": 1,
      "maxLength": 64,
      "description": "opaque id shared by every event in one session"
    },
    "timestamp": {
      "type": "string",
      "pattern": "^\\d{4}-\\d{2}-\\d{2}T\\d{2}:\\d{2}:\\d{2}(\\.\\d{1,6})?Z$",
      "description": "utc, iso 8601, ends in Z, e.g. 2026-10-24T18:03:11.250Z"
    },
    "source": {
      "type": "string",
      "enum": [
        "wild",
        "guest",
        "team",
        "mock"
      ],
      "description": "wild = real internet traffic. only wild counts in stats"
    },
    "Geo": {
      "type": "object",
      "title": "Geo",
      "properties": {
        "lat": {
          "type": "number",
          "minimum": -90,
          "maximum": 90,
          "description": "rounded to 2 decimals"
        },
        "lon": {
          "type": "number",
          "minimum": -180,
          "maximum": 180,
          "description": "rounded to 2 decimals"
        },
        "country": {
          "type": "string",
          "pattern": "^[A-Z]{2}$",
          "description": "iso 3166-1 alpha-2, XX if unknown"
        },
        "city": {
          "type": [
            "string",
            "null"
          ]
        }
      },
      "required": [
        "lat",
        "lon",
        "country",
        "city"
      ],
      "additionalProperties": false
    },
    "Attacker": {
      "type": "object",
      "title": "Attacker",
      "properties": {
        "kind": {
          "type": "string",
          "enum": [
            "bot",
            "human",
            "agent",
            "unknown"
          ]
        },
        "confidence": {
          "type": "number",
          "minimum": 0,
          "maximum": 1
        },
        "reputation": {
          "type": "string",
          "enum": [
            "harmless",
            "unknown",
            "malicious"
          ]
        },
        "family": {
          "type": [
            "string",
            "null"
          ],
          "description": "known botnet or tool family, if any"
        },
        "threat": {
          "type": "string",
          "enum": [
            "low",
            "med",
            "high",
            "critical"
          ]
        },
        "client": {
          "type": [
            "string",
            "null"
          ],
          "description": "ssh client version or http user agent"
        },
        "ip_hash": {
          "type": [
            "string",
            "null"
          ],
          "pattern": "^[0-9a-f]{64}$",
          "description": "salted sha256 of the source ip"
        }
      },
      "required": [
        "kind",
        "confidence",
        "reputation",
        "family",
        "threat",
        "client",
        "ip_hash"
      ],
      "additionalProperties": false
    }
  }
}
